smartctl pre-7.4 2023-03-21 r5470 [x86_64-linux-6.2.7-200.fc37.x86_64] (CircleCI)
Copyright (C) 2002-23, Bruce Allen, Christian Franke, www.smartmontools.org

=== START OF INFORMATION SECTION ===
Model Number:                       KBG30ZMV256G TOSHIBA
Serial Number:                      68APC048P12P
Firmware Version:                   ADHA0101
PCI Vendor/Subsystem ID:            0x1179
IEEE OUI Identifier:                0x00080d
Controller ID:                      0
NVMe Version:                       1.2.1
Number of Namespaces:               1
Namespace 1 Size/Capacity:          256.060.514.304 [256 GB]
Namespace 1 Formatted LBA Size:     512
Namespace 1 IEEE EUI-64:            00080d 040017b710
Local Time is:                      Mon Mar 27 12:52:23 2023 CEST
Firmware Updates (0x12):            1 Slot, no Reset required
Optional Admin Commands (0x0017):   Security Format Frmw_DL Self_Test
Optional NVM Commands (0x0017):     Comp Wr_Unc DS_Mngmt Sav/Sel_Feat
Log Page Attributes (0x02):         Cmd_Eff_Lg
Maximum Data Transfer Size:         512 Pages
Warning  Comp. Temp. Threshold:     82 Celsius
Critical Comp. Temp. Threshold:     85 Celsius

Supported Power States
St Op     Max   Active     Idle   RL RT WL WT  Ent_Lat  Ex_Lat
 0 +     3.30W       -        -    0  0  0  0        0       0
 1 +     2.70W       -        -    1  1  1  1        0       0
 2 +     2.30W       -        -    2  2  2  2        0       0
 3 -   0.0500W       -        -    4  4  4  4     8000   32000
 4 -   0.0050W       -        -    4  4  4  4     8000   40000

Supported LBA Sizes (NSID 0x1)
Id Fmt  Data  Metadt  Rel_Perf
 0 -    4096       0         0
 1 +     512       0         3

=== START OF SMART DATA SECTION ===
SMART overall-health self-assessment test result: PASSED

SMART/Health Information (NVMe Log 0x02)
Critical Warning:                   0x00
Temperature:                        59 Celsius
Available Spare:                    100%
Available Spare Threshold:          10%
Percentage Used:                    32%
Data Units Read:                    33.835.011 [17,3 TB]
Data Units Written:                 36.580.058 [18,7 TB]
Host Read Commands:                 661.971.168
Host Write Commands:                1.017.975.532
Controller Busy Time:               14.050
Power Cycles:                       1.545
Power On Hours:                     8.737
Unsafe Shutdowns:                   102
Media and Data Integrity Errors:    0
Error Information Log Entries:      2.597
Warning  Comp. Temperature Time:    0
Critical Comp. Temperature Time:    0
Temperature Sensor 1:               59 Celsius
Thermal Temp. 1 Transition Count:   5939
Thermal Temp. 2 Transition Count:   3423
Thermal Temp. 1 Total Time:         70406
Thermal Temp. 2 Total Time:         7129

Error Information (NVMe Log 0x01, 16 of 64 entries)
Num   ErrCount  SQId   CmdId  Status  PELoc          LBA  NSID    VS
  0       2597     0  0x1001  0xc005  0x028            -     0     -

Self-test Log (NVMe Log 0x06)
Self-test status: No self-test in progress
Num  Test_Description  Status                       Power_on_Hours  Failing_LBA  NSID SCT Code
 0   Short             Completed without error                8737            -     -   -    -
