smartctl 6.6 2016-05-31 r4324 [x86_64-linux-5.4.0-126-generic] (local build)
Copyright (C) 2002-16, Bruce Allen, Christian Franke, www.smartmontools.org

=== START OF INFORMATION SECTION ===
Device Model:     LITEONIT LCT-512L9S-11 2.5 7mm 512GB
Serial Number:    TW0HN71H5508549A1220
Firmware Version: HC9110D
User Capacity:    512,110,190,592 bytes [512 GB]
Sector Size:      512 bytes logical/physical
Rotation Rate:    Solid State Device
Device is:        Not in smartctl database [for details use: -P showall]
ATA Version is:   ATA8-ACS, ATA/ATAPI-7 T13/1532D revision 4a
SATA Version is:  SATA 3.1, 6.0 Gb/s (current: 6.0 Gb/s)
Local Time is:    Tue Oct 18 08:18:02 2022 UTC
SMART support is: Available - device has SMART capability.
SMART support is: Enabled

=== START OF READ SMART DATA SECTION ===
SMART overall-health self-assessment test result: PASSED

General SMART Values:
Offline data collection status:  (0x00)	Offline data collection activity
					was never started.
					Auto Offline Data Collection: Disabled.
Self-test execution status:      (   0)	The previous self-test routine completed
					without error or no self-test has ever 
					been run.
Total time to complete Offline 
data collection: 		(   10) seconds.
Offline data collection
capabilities: 			 (0x15) SMART execute Offline immediate.
					No Auto Offline data collection support.
					Abort Offline collection upon new
					command.
					No Offline surface scan supported.
					Self-test supported.
					No Conveyance Self-test supported.
					No Selective Self-test supported.
SMART capabilities:            (0x0003)	Saves SMART data before entering
					power-saving mode.
					Supports SMART auto save timer.
Error logging capability:        (0x01)	Error logging supported.
					General Purpose Logging supported.
Short self-test routine 
recommended polling time: 	 (   1) minutes.
Extended self-test routine
recommended polling time: 	 (  10) minutes.
SCT capabilities: 	       (0x003d)	SCT Status supported.
					SCT Error Recovery Control supported.
					SCT Feature Control supported.
					SCT Data Table supported.

SMART Attributes Data Structure revision number: 4
Vendor Specific SMART Attributes with Thresholds:
ID# ATTRIBUTE_NAME          FLAG     VALUE WORST THRESH TYPE      UPDATED  WHEN_FAILED RAW_VALUE
  5 Reallocated_Sector_Ct   0x0032   100   100   ---    Old_age   Always       -       0
  9 Power_On_Hours          0x0032   100   100   ---    Old_age   Always       -       20379
 12 Power_Cycle_Count       0x0032   100   100   ---    Old_age   Always       -       5
165 Unknown_Attribute       0x0032   100   100   ---    Old_age   Always       -       120193844
166 Unknown_Attribute       0x0032   100   100   ---    Old_age   Always       -       1
167 Unknown_Attribute       0x0032   100   100   ---    Old_age   Always       -       34
168 Unknown_Attribute       0x0032   100   100   ---    Old_age   Always       -       5
169 Unknown_Attribute       0x0032   100   100   ---    Old_age   Always       -       328
170 Unknown_Attribute       0x0032   100   100   ---    Old_age   Always       -       0
171 Unknown_Attribute       0x0032   100   100   ---    Old_age   Always       -       0
172 Unknown_Attribute       0x0032   100   100   ---    Old_age   Always       -       0
173 Unknown_Attribute       0x0032   100   100   ---    Old_age   Always       -       2
174 Unknown_Attribute       0x0032   100   100   ---    Old_age   Always       -       1
184 End-to-End_Error        0x0032   100   100   ---    Old_age   Always       -       0
187 Reported_Uncorrect      0x0032   100   100   ---    Old_age   Always       -       0
188 Command_Timeout         0x0032   100   100   ---    Old_age   Always       -       1
194 Temperature_Celsius     0x0022   067   039   ---    Old_age   Always       -       33 (Min/Max 18/39)
199 UDMA_CRC_Error_Count    0x0032   100   100   ---    Old_age   Always       -       0
230 Unknown_SSD_Attribute   0x0032   001   001   ---    Old_age   Always       -       1374390845760
232 Available_Reservd_Space 0x0033   100   100   004    Pre-fail  Always       -       100
233 Media_Wearout_Indicator 0x0032   100   100   ---    Old_age   Always       -       1053
234 Unknown_Attribute       0x0032   100   100   ---    Old_age   Always       -       9459
241 Total_LBAs_Written      0x0030   253   253   ---    Old_age   Offline      -       3891
242 Total_LBAs_Read         0x0030   253   253   ---    Old_age   Offline      -       19010
244 Unknown_Attribute       0x0032   000   100   ---    Old_age   Always       -       0

SMART Error Log Version: 0
No Errors Logged

SMART Self-test log structure revision number 1
Num  Test_Description    Status                  Remaining  LifeTime(hours)  LBA_of_first_error
# 1  Short offline       Completed without error       00%      2376         -
# 2  Short offline       Completed without error       00%      2376         -
# 3  Short offline       Completed without error       00%      1501         -
# 4  Short offline       Completed without error       00%      1499         -
# 5  Extended offline    Aborted by host               10%      1499         -
# 6  Short offline       Completed without error       00%      1498         -
# 7  Short offline       Completed without error       00%      1498         -
# 8  Short offline       Completed without error       00%      1498         -
# 9  Short offline       Completed without error       00%      1454         -

Selective Self-tests/Logging not supported