smartctl 7.1 2019-12-30 r5022 [x86_64-linux-5.4.0-73-generic] (local build)           
Copyright (C) 2002-19, Bruce Allen, Christian Franke, www.smartmontools.org           
                                                                                      
=== START OF INFORMATION SECTION ===                                                  
Model Family:     Intel 730 and DC S35x0/3610/3700 Series SSDs                        
Device Model:     INTEL SSDSC2BB120G6                                                 
Serial Number:    BXXXXXXXXXXXXXXXXN                                                  
LU WWN Device Id: 5 5cd2e4 04b7ffea4                                                  
Firmware Version: G2010130                                                            
User Capacity:    120,034,123,776 bytes [120 GB]                                      
Sector Sizes:     512 bytes logical, 4096 bytes physical                              
Rotation Rate:    Solid State Device                                                  
Form Factor:      2.5 inches                                                          
Device is:        In smartctl database [for details use: -P show]                     
ATA Version is:   ACS-2 T13/2015-D revision 3                                         
SATA Version is:  SATA 2.6, 6.0 Gb/s (current: 6.0 Gb/s)                              
Local Time is:    Tue Jul 27 11:11:07 2021 CEST                                       
SMART support is: Available - device has SMART capability.                            
SMART support is: Enabled                                                             
                                                                                      
=== START OF READ SMART DATA SECTION ===                                              
SMART Status not supported: ATA return descriptor not supported by controller firmware
SMART overall-health self-assessment test result: PASSED                              
Warning: This result is based on an Attribute check.                                  
                                                                                      
General SMART Values:                                                                 
Offline data collection status:  (0x02) Offline data collection activity              
                                        was completed without error.                  
                                        Auto Offline Data Collection: Disabled.       
Self-test execution status:      (   0) The previous self-test routine completed      
                                        without error or no self-test has ever        
                                        been run.                                     
Total time to complete Offline                                                        
data collection:                (    2) seconds.                                      
Offline data collection                                                               
capabilities:                    (0x79) SMART execute Offline immediate.              
                                        No Auto Offline data collection support.      
                                        Suspend Offline collection upon new
                                        command. 
                                        Offline surface scan supported.
                                        Self-test supported.
                                        Conveyance Self-test supported.
                                        Selective Self-test supported.
SMART capabilities:            (0x0003) Saves SMART data before entering
                                        power-saving mode.
                                        Supports SMART auto save timer.
Error logging capability:        (0x01) Error logging supported.
                                        General Purpose Logging supported.
Short self-test routine 
recommended polling time:        (   1) minutes.
Extended self-test routine
recommended polling time:        (   2) minutes.
Conveyance self-test routine
recommended polling time:        (   2) minutes.
SCT capabilities:              (0x003d) SCT Status supported.
                                        SCT Error Recovery Control supported.
                                        SCT Feature Control supported.
                                        SCT Data Table supported.

SMART Attributes Data Structure revision number: 1
Vendor Specific SMART Attributes with Thresholds:
ID# ATTRIBUTE_NAME          FLAG     VALUE WORST THRESH TYPE      UPDATED  WHEN_FAILED RAW_VALUE 
  5 Reallocated_Sector_Ct   0x0032   100   100   000    Old_age   Always       -       0
  9 Power_On_Hours          0x0032   100   100   000    Old_age   Always       -       43583
 12 Power_Cycle_Count       0x0032   100   100   000    Old_age   Always       -       55
170 Available_Reservd_Space 0x0033   100   100   010    Pre-fail  Always       -       0
171 Program_Fail_Count      0x0032   100   100   000    Old_age   Always       -       0
172 Erase_Fail_Count        0x0032   100   100   000    Old_age   Always       -       0
174 Unsafe_Shutdown_Count   0x0032   100   100   000    Old_age   Always       -       25
175 Power_Loss_Cap_Test     0x0033   100   100   010    Pre-fail  Always       -       4170 (247 9539)
183 SATA_Downshift_Count    0x0032   100   100   000    Old_age   Always       -       0
184 End-to-End_Error        0x0033   100   100   090    Pre-fail  Always       -       0
187 Reported_Uncorrect      0x0032   100   100   000    Old_age   Always       -       0
190 Temperature_Case        0x0022   068   056   000    Old_age   Always       -       32 (Min/Max 28/44)
192 Unsafe_Shutdown_Count   0x0032   100   100   000    Old_age   Always       -       25
194 Temperature_Internal    0x0022   100   100   000    Old_age   Always       -       32
197 Current_Pending_Sector  0x0012   100   100   000    Old_age   Always       -       0
199 CRC_Error_Count         0x003e   100   100   000    Old_age   Always       -       0
225 Host_Writes_32MiB       0x0032   100   100   000    Old_age   Always       -       1412735
226 Workld_Media_Wear_Indic 0x0032   100   100   000    Old_age   Always       -       14878
227 Workld_Host_Reads_Perc  0x0032   100   100   000    Old_age   Always       -       39
228 Workload_Minutes        0x0032   100   100   000    Old_age   Always       -       2614723
232 Available_Reservd_Space 0x0033   100   100   010    Pre-fail  Always       -       0
233 Media_Wearout_Indicator 0x0032   086   086   000    Old_age   Always       -       0
234 Thermal_Throttle        0x0032   100   100   000    Old_age   Always       -       0/0
241 Host_Writes_32MiB       0x0032   100   100   000    Old_age   Always       -       1412735
242 Host_Reads_32MiB        0x0032   100   100   000    Old_age   Always       -       907688

SMART Error Log Version: 1
No Errors Logged

SMART Self-test log structure revision number 1
Num  Test_Description    Status                  Remaining  LifeTime(hours)  LBA_of_first_error
# 1  Short offline       Completed without error       00%     42889         -

SMART Selective self-test log data structure revision number 1
 SPAN  MIN_LBA  MAX_LBA  CURRENT_TEST_STATUS
    1        0        0  Not_testing
    2        0        0  Not_testing
    3        0        0  Not_testing
    4        0        0  Not_testing
    5        0        0  Not_testing
Selective self-test flags (0x0):
  After scanning selected spans, do NOT read-scan remainder of disk.
If Selective self-test is pending on power-up, resume after 0 minute delay.

