smartctl 7.1 2019-12-30 r5022 [x86_64-linux-5.4.0-99-generic] (local build)
Copyright (C) 2002-19, Bruce Allen, Christian Franke, www.smartmontools.org

=== START OF INFORMATION SECTION ===
Model Number: KCM61VUL1T60
Serial Number: 61B0A066T1K8
Firmware Version: 0105
PCI Vendor/Subsystem ID: 0x1e0f
IEEE OUI Identifier: 0x8ce38e
Total NVM Capacity: 1 600 321 314 816 [1,60 TB]
Unallocated NVM Capacity: 0
Controller ID: 1
Number of Namespaces: 64
Local Time is: Thu Dec 8 11:37:18 2022 MSK
Firmware Updates (0x16): 3 Slots, no Reset required
Optional Admin Commands (0x025f): Security Format Frmw_DL NS_Mngmt Self_Test MI_Snd/Rec Other
Optional NVM Commands (0x00ff): Comp Wr_Unc DS_Mngmt Wr_Zero Sav/Sel_Feat Resv Timestmp Other
Maximum Data Transfer Size: 8192 Pages
Warning Comp. Temp. Threshold: 73 Celsius
Critical Comp. Temp. Threshold: 82 Celsius

Supported Power States
St Op Max Active Idle RL RT WL WT Ent_Lat Ex_Lat
0 + 27.50W 25.00W - 0 0 0 0 500000 500000
1 + 19.80W 18.00W - 0 0 1 1 500000 500000
2 + 17.60W 16.00W - 0 0 2 2 500000 500000
3 + 15.40W 14.00W - 1 1 3 3 500000 500000
4 + 12.10W 11.00W - 2 2 4 4 500000 500000
5 + 9.90W 9.00W - 3 3 5 5 500000 500000
6 - 5.00W - - 6 6 6 6 500000 500000

=== START OF SMART DATA SECTION ===
SMART overall-health self-assessment test result: PASSED

SMART/Health Information (NVMe Log 0x02)
Critical Warning: 0x00
Temperature: 46 Celsius
Available Spare: 100%
Available Spare Threshold: 12%
Percentage Used: 0%
Data Units Read: 11 442 052 [5,85 TB]
Data Units Written: 36 848 011 [18,8 TB]
Host Read Commands: 48 159 985
Host Write Commands: 145 411 665
Controller Busy Time: 135
Power Cycles: 503
Power On Hours: 2 144
Unsafe Shutdowns: 298
Media and Data Integrity Errors: 0
Error Information Log Entries: 197
Warning Comp. Temperature Time: 61
Critical Comp. Temperature Time: 0
Thermal Temp. 1 Transition Count: 8
Thermal Temp. 2 Transition Count: 3
Thermal Temp. 1 Total Time: 420
Thermal Temp. 2 Total Time: 3380

Error Information (NVMe Log 0x01, max 256 entries)
Num ErrCount SQId CmdId Status PELoc LBA NSID VS
0 197 0 0x0008 0xc004 0x02b - 0 -