smartctl 7.1 2019-12-30 r5022 [x86_64-linux-5.4.0-99-generic] (local build)
Copyright (C) 2002-19, Bruce Allen, Christian Franke, www.smartmontools.org

=== START OF INFORMATION SECTION ===
Model Number: KCM61VUL1T60
Serial Number: 61B0A067T1K8
Firmware Version: 0105
PCI Vendor/Subsystem ID: 0x1e0f
IEEE OUI Identifier: 0x8ce38e
Total NVM Capacity: 1 600 321 314 816 [1,60 TB]
Unallocated NVM Capacity: 0
Controller ID: 1
Number of Namespaces: 64
Local Time is: Thu Dec 8 11:32:32 2022 MSK
Firmware Updates (0x16): 3 Slots, no Reset required
Optional Admin Commands (0x025f): Security Format Frmw_DL NS_Mngmt Self_Test MI_Snd/Rec Other
Optional NVM Commands (0x00ff): Comp Wr_Unc DS_Mngmt Wr_Zero Sav/Sel_Feat Resv Timestmp Other
Maximum Data Transfer Size: 8192 Pages
Warning Comp. Temp. Threshold: 73 Celsius
Critical Comp. Temp. Threshold: 82 Celsius

Supported Power States
St Op Max Active Idle RL RT WL WT Ent_Lat Ex_Lat
0 + 27.50W 25.00W - 0 0 0 0 500000 500000
1 + 19.80W 18.00W - 0 0 1 1 500000 500000
2 + 17.60W 16.00W - 0 0 2 2 500000 500000
3 + 15.40W 14.00W - 1 1 3 3 500000 500000
4 + 12.10W 11.00W - 2 2 4 4 500000 500000
5 + 9.90W 9.00W - 3 3 5 5 500000 500000
6 - 5.00W - - 6 6 6 6 500000 500000

=== START OF SMART DATA SECTION ===
SMART overall-health self-assessment test result: PASSED

SMART/Health Information (NVMe Log 0x02)
Critical Warning: 0x00
Temperature: 45 Celsius
Available Spare: 100%
Available Spare Threshold: 12%
Percentage Used: 0%
Data Units Read: 81 966 502 [41,9 TB]
Data Units Written: 56 742 372 [29,0 TB]
Host Read Commands: 1 868 020 852
Host Write Commands: 1 054 642 944
Controller Busy Time: 567
Power Cycles: 497
Power On Hours: 1 998
Unsafe Shutdowns: 423
Media and Data Integrity Errors: 0
Error Information Log Entries: 283
Warning Comp. Temperature Time: 284
Critical Comp. Temperature Time: 0
Thermal Temp. 1 Transition Count: 18
Thermal Temp. 2 Transition Count: 4
Thermal Temp. 1 Total Time: 1440
Thermal Temp. 2 Total Time: 15910

Error Information (NVMe Log 0x01, max 256 entries)
Num ErrCount SQId CmdId Status PELoc LBA NSID VS
0 283 0 0x000c 0xc004 0x02b - 0 -