smartctl 7.3 2022-02-28 r5338 [x86_64-w64-mingw32-w11-b22621] (sf-7.3-1)
Copyright (C) 2002-22, Bruce Allen, Christian Franke, www.smartmontools.org

=== START OF INFORMATION SECTION ===
Model Number:                       Netac NVMe SSD 2TB
Serial Number:                      RN202303092TB677720
Firmware Version:                   3.S.J.11
PCI Vendor ID:                      0x1f40
PCI Vendor Subsystem ID:            0x1dbe
IEEE OUI Identifier:                0xa84397
Total NVM Capacity:                 0
Unallocated NVM Capacity:           18,446,742,073,310,617,600 [18446 PB]
Controller ID:                      0
NVMe Version:                       1.4
Number of Namespaces:               1
Namespace 1 Size/Capacity:          2,000,398,934,016 [2.00 TB]
Namespace 1 Formatted LBA Size:     512
Namespace 1 IEEE EUI-64:            a84397 0000677720
Local Time is:                      Mon Jun 26 19:37:33 2023 
Firmware Updates (0x0e):            7 Slots
Optional Admin Commands (0x0017):   Security Format Frmw_DL Self_Test
Optional NVM Commands (0x0014):     DS_Mngmt Sav/Sel_Feat
Log Page Attributes (0x0e):         Cmd_Eff_Lg Ext_Get_Lg Telmtry_Lg
Maximum Data Transfer Size:         512 Pages
Warning  Comp. Temp. Threshold:     120 Celsius
Critical Comp. Temp. Threshold:     130 Celsius

Supported Power States
St Op     Max   Active     Idle   RL RT WL WT  Ent_Lat  Ex_Lat
 0 +     3.50W       -        -    0  0  0  0        5       5
 1 +     3.30W       -        -    1  1  1  1       50     100
 2 +     3.10W       -        -    2  2  2  2       50     200
 3 -   0.1500W       -        -    3  3  3  3      500    5000
 4 -   0.0200W       -        -    4  4  4  4     2000   85000

Supported LBA Sizes (NSID 0x1)
Id Fmt  Data  Metadt  Rel_Perf
 0 +     512       0         0

=== START OF SMART DATA SECTION ===
SMART overall-health self-assessment test result: PASSED

SMART/Health Information (NVMe Log 0x02)
Critical Warning:                   0x00
Temperature:                        54 Celsius
Available Spare:                    100%
Available Spare Threshold:          25%
Percentage Used:                    0%
Data Units Read:                    4,830,606 [2.47 TB]
Data Units Written:                 4,952,637 [2.53 TB]
Host Read Commands:                 46,021,676
Host Write Commands:                36,945,951
Controller Busy Time:               5
Power Cycles:                       106
Power On Hours:                     509
Unsafe Shutdowns:                   5
Media and Data Integrity Errors:    0
Error Information Log Entries:      0
Warning  Comp. Temperature Time:    0
Critical Comp. Temperature Time:    0
Temperature Sensor 1:               55 Celsius
Temperature Sensor 2:               46 Celsius
Thermal Temp. 1 Transition Count:   2
Thermal Temp. 1 Total Time:         9141

Error Information (NVMe Log 0x01, 16 of 64 entries)
No Errors Logged

