smartctl 7.4 2023-08-01 r5530 [Darwin 23.2.0 x86_64] (local build)
Copyright (C) 2002-23, Bruce Allen, Christian Franke, www.smartmontools.org

=== START OF INFORMATION SECTION ===
Model Number:                       APPLE SSD AP0512Z
Serial Number:                      0ba0224b2254ca3c
Firmware Version:                   359.60.3
PCI Vendor/Subsystem ID:            0x106b
IEEE OUI Identifier:                0x000000
Controller ID:                      0
NVMe Version:                       <1.2
Number of Namespaces:               3
Local Time is:                      Thu Mar 28 15:22:22 2024 PDT
Firmware Updates (0x02):            1 Slot
Optional Admin Commands (0x0004):   Frmw_DL
Optional NVM Commands (0x0004):     DS_Mngmt
Maximum Data Transfer Size:         256 Pages

Supported Power States
St Op     Max   Active     Idle   RL RT WL WT  Ent_Lat  Ex_Lat
 0 +     0.00W       -        -    0  0  0  0        0       0

=== START OF SMART DATA SECTION ===
SMART overall-health self-assessment test result: PASSED

SMART/Health Information (NVMe Log 0x02)
Critical Warning:                   0x00
Temperature:                        19 Celsius
Available Spare:                    100%
Available Spare Threshold:          99%
Percentage Used:                    0%
Data Units Read:                    499,872 [255 GB]
Data Units Written:                 695,150 [355 GB]
Host Read Commands:                 14,376,794
Host Write Commands:                12,469,540
Controller Busy Time:               0
Power Cycles:                       61
Power On Hours:                     10
Unsafe Shutdowns:                   8
Media and Data Integrity Errors:    0
Error Information Log Entries:      0

Read 1 entries from Error Information Log failed: GetLogPage failed: system=0x38, sub=0x0, code=745