smartctl 7.3 2022-02-28 r5338 [x86_64-w64-mingw32-w10-21H2] (sf-7.3-1)
Copyright (C) 2002-22, Bruce Allen, Christian Franke, www.smartmontools.org

=== START OF INFORMATION SECTION ===
Model Number: WDS100T3X0C-00SJG0
Serial Number: 20093F800129
Firmware Version: 111110WD
PCI Vendor/Subsystem ID: 0x15b7
IEEE OUI Identifier: 0x001b44
Total NVM Capacity: 1,000,204,886,016 [1.00 TB]
Unallocated NVM Capacity: 0
Controller ID: 8215
NVMe Version: 1.3
Number of Namespaces: 1
Namespace 1 Size/Capacity: 1,000,204,886,016 [1.00 TB]
Namespace 1 Formatted LBA Size: 512
Namespace 1 IEEE EUI-64: 001b44 8b46ac714d
Local Time is: Tue Sep 13 22:59:47 2022
Firmware Updates (0x14): 2 Slots, no Reset required
Optional Admin Commands (0x0017): Security Format Frmw_DL Self_Test
Optional NVM Commands (0x005f): Comp Wr_Unc DS_Mngmt Wr_Zero Sav/Sel_Feat Timestmp
Log Page Attributes (0x0e): Cmd_Eff_Lg Ext_Get_Lg Telmtry_Lg
Maximum Data Transfer Size: 128 Pages
Warning Comp. Temp. Threshold: 84 Celsius
Critical Comp. Temp. Threshold: 88 Celsius
Namespace 1 Features (0x02): NA_Fields

Supported Power States
St Op Max Active Idle RL RT WL WT Ent_Lat Ex_Lat
0 + 6.00W - - 0 0 0 0 0 0
1 + 3.50W - - 1 1 1 1 0 0
2 + 3.00W - - 2 2 2 2 0 0
3 - 0.1000W - - 3 3 3 3 4000 10000
4 - 0.0025W - - 4 4 4 4 4000 40000

Supported LBA Sizes (NSID 0x1)
Id Fmt Data Metadt Rel_Perf
0 + 512 0 2
1 - 4096 0 1

=== START OF SMART DATA SECTION ===
SMART overall-health self-assessment test result: PASSED

SMART/Health Information (NVMe Log 0x02)
Critical Warning: 0x00
Temperature: 25 Celsius
Available Spare: 100%
Available Spare Threshold: 10%
Percentage Used: 0%
Data Units Read: 19,767,249 [10.1 TB]
Data Units Written: 24,283,768 [12.4 TB]
Host Read Commands: 256,331,082
Host Write Commands: 207,405,294
Controller Busy Time: 496
Power Cycles: 508
Power On Hours: 2,608
Unsafe Shutdowns: 39
Media and Data Integrity Errors: 0
Error Information Log Entries: 261
Warning Comp. Temperature Time: 2
Critical Comp. Temperature Time: 0

Error Information (NVMe Log 0x01, 16 of 256 entries)
No Errors Logged